"No.","Time","Source","Destination","Protocol","Address","Length","Name","Info"
"1","0.000000","Cisco_a7:49:00","Broadcast","ARP","","42","","Gratuitous ARP for 10.169.152.228 (Reply)"
"2","1.552992","10.169.156.72","239.255.255.250","SSDP","","167","","M-SEARCH * HTTP/1.1 "
"3","1.899784","10.169.156.72","224.0.0.251","MDNS","","489","_airport._tcp.local,_apple-mobdev._tcp.local,96c30821._sub._apple-mobdev2._tcp.local,_apple-pairable._tcp.local,_meshcop._udp.local,_homekit._tcp.local,_companion-link._tcp.local,_rdlink._tcp.local,_scanner._tcp.local,_uscans._tcp.local,_uscan._tcp.local,_ipp._tcp.local,_ippusb._tcp.local,_ipps._tcp.local,_printer._tcp.local,_pdl-datastream._tcp.local,_ptp._tcp.local,_sleep-proxy._udp.local,_spotify-connect._tcp.local,_afpovertcp._tcp.local,_smb._tcp.local,_rfb._tcp.local,_adisk._tcp.local","Standard query 0x0000 PTR _airport._tcp.local, ""QM"" question PTR _apple-mobdev._tcp.local, ""QM"" question PTR 96c30821._sub._apple-mobdev2._tcp.local, ""QM"" question PTR _apple-pairable._tcp.local, ""QM"" question PTR _meshcop._udp.local, ""QM"" question PTR _homekit._tcp.local, ""QM"" question PTR _companion-link._tcp.local, ""QM"" question PTR _rdlink._tcp.local, ""QM"" question PTR _scanner._tcp.local, ""QM"" question PTR _uscans._tcp.local, ""QM"" question PTR _uscan._tcp.local, ""QM"" question PTR _ipp._tcp.local, ""QM"" question PTR _ippusb._tcp.local, ""QM"" question PTR _ipps._tcp.local, ""QM"" question PTR _printer._tcp.local, ""QM"" question PTR _pdl-datastream._tcp.local, ""QM"" question PTR _ptp._tcp.local, ""QM"" question PTR _sleep-proxy._udp.local, ""QM"" question PTR _spotify-connect._tcp.local, ""QM"" question PTR _afpovertcp._tcp.local, ""QM"" question PTR _smb._tcp.local, ""QM"" question PTR _rfb._tcp.local, ""QM"" question PTR _adisk._tcp.local, ""QM"" question PTR MacBook Pro di Andrea (2)._companion-link._tcp.local"
"4","1.899785","fe80::1077:59f9:f102:22da","ff02::fb","MDNS","","509","_airport._tcp.local,_apple-mobdev._tcp.local,96c30821._sub._apple-mobdev2._tcp.local,_apple-pairable._tcp.local,_meshcop._udp.local,_homekit._tcp.local,_companion-link._tcp.local,_rdlink._tcp.local,_scanner._tcp.local,_uscans._tcp.local,_uscan._tcp.local,_ipp._tcp.local,_ippusb._tcp.local,_ipps._tcp.local,_printer._tcp.local,_pdl-datastream._tcp.local,_ptp._tcp.local,_sleep-proxy._udp.local,_spotify-connect._tcp.local,_afpovertcp._tcp.local,_smb._tcp.local,_rfb._tcp.local,_adisk._tcp.local","Standard query 0x0000 PTR _airport._tcp.local, ""QM"" question PTR _apple-mobdev._tcp.local, ""QM"" question PTR 96c30821._sub._apple-mobdev2._tcp.local, ""QM"" question PTR _apple-pairable._tcp.local, ""QM"" question PTR _meshcop._udp.local, ""QM"" question PTR _homekit._tcp.local, ""QM"" question PTR _companion-link._tcp.local, ""QM"" question PTR _rdlink._tcp.local, ""QM"" question PTR _scanner._tcp.local, ""QM"" question PTR _uscans._tcp.local, ""QM"" question PTR _uscan._tcp.local, ""QM"" question PTR _ipp._tcp.local, ""QM"" question PTR _ippusb._tcp.local, ""QM"" question PTR _ipps._tcp.local, ""QM"" question PTR _printer._tcp.local, ""QM"" question PTR _pdl-datastream._tcp.local, ""QM"" question PTR _ptp._tcp.local, ""QM"" question PTR _sleep-proxy._udp.local, ""QM"" question PTR _spotify-connect._tcp.local, ""QM"" question PTR _afpovertcp._tcp.local, ""QM"" question PTR _smb._tcp.local, ""QM"" question PTR _rfb._tcp.local, ""QM"" question PTR _adisk._tcp.local, ""QM"" question PTR MacBook Pro di Andrea (2)._companion-link._tcp.local"
"5","3.884239","10.169.156.72","17.57.146.52","TLSv1.2","","849","","Application Data"
"6","3.908178","17.57.146.52","10.169.156.72","TCP","","66","","443  >  49464 [ACK] Seq=1 Ack=784 Win=475 Len=0 TSval=2218059580 TSecr=495587207"
"7","3.908559","17.57.146.52","10.169.156.72","TLSv1.2","","100","","Application Data"
"8","3.908666","10.169.156.72","17.57.146.52","TCP","","66","","49464  >  443 [ACK] Seq=784 Ack=35 Win=2047 Len=0 TSval=495587230 TSecr=2218059580"
"9","5.121230","17.57.146.52","10.169.156.72","TLSv1.2","","130","","Application Data"
"10","5.121344","10.169.156.72","17.57.146.52","TCP","","66","","49464  >  443 [ACK] Seq=784 Ack=99 Win=2047 Len=0 TSval=495588440 TSecr=2218060734"
"11","5.123783","10.169.156.72","17.57.146.52","TLSv1.2","","98","","Application Data"
"12","5.180922","17.57.146.52","10.169.156.72","TCP","","66","","443  >  49464 [ACK] Seq=99 Ack=816 Win=475 Len=0 TSval=2218060853 TSecr=495588442"
"13","5.587338","10.169.156.72","162.125.19.9","TLSv1.2","","221","","Application Data"
"14","5.587339","10.169.156.72","162.125.19.9","TCP","","1494","","49356  >  443 [ACK] Seq=156 Ack=1 Win=2048 Len=1428 TSval=495588902 TSecr=2768655115 [TCP segment of a reassembled PDU]"
"15","5.587339","10.169.156.72","162.125.19.9","TCP","","1494","","49356  >  443 [ACK] Seq=1584 Ack=1 Win=2048 Len=1428 TSval=495588902 TSecr=2768655115 [TCP segment of a reassembled PDU]"
"16","5.587339","10.169.156.72","162.125.19.9","TCP","","1494","","49356  >  443 [ACK] Seq=3012 Ack=1 Win=2048 Len=1428 TSval=495588902 TSecr=2768655115 [TCP segment of a reassembled PDU]"
"17","5.587340","10.169.156.72","162.125.19.9","TCP","","1494","","49356  >  443 [ACK] Seq=4440 Ack=1 Win=2048 Len=1428 TSval=495588902 TSecr=2768655115 [TCP segment of a reassembled PDU]"
"18","5.587340","10.169.156.72","162.125.19.9","TCP","","1494","","49356  >  443 [ACK] Seq=5868 Ack=1 Win=2048 Len=1428 TSval=495588902 TSecr=2768655115 [TCP segment of a reassembled PDU]"
"19","5.587340","10.169.156.72","162.125.19.9","TCP","","1494","","49356  >  443 [ACK] Seq=7296 Ack=1 Win=2048 Len=1428 TSval=495588902 TSecr=2768655115 [TCP segment of a reassembled PDU]"
"20","5.587341","10.169.156.72","162.125.19.9","TCP","","1494","","49356  >  443 [ACK] Seq=8724 Ack=1 Win=2048 Len=1428 TSval=495588902 TSecr=2768655115 [TCP segment of a reassembled PDU]"
"21","5.587341","10.169.156.72","162.125.19.9","TLSv1.2","","964","","Application Data"
"22","5.694720","162.125.19.9","10.169.156.72","TCP","","66","","443  >  49356 [ACK] Seq=1 Ack=156 Win=425 Len=0 TSval=2768713109 TSecr=495588902"
"23","5.694860","162.125.19.9","10.169.156.72","TCP","","66","","443  >  49356 [ACK] Seq=1 Ack=4440 Win=442 Len=0 TSval=2768713109 TSecr=495588902"
"24","5.694948","162.125.19.9","10.169.156.72","TCP","","66","","443  >  49356 [ACK] Seq=1 Ack=7296 Win=453 Len=0 TSval=2768713109 TSecr=495588902"
"25","5.695167","162.125.19.9","10.169.156.72","TCP","","66","","443  >  49356 [ACK] Seq=1 Ack=11050 Win=468 Len=0 TSval=2768713110 TSecr=495588902"
"26","5.700036","162.125.19.9","10.169.156.72","TLSv1.2","","824","","Application Data"
"27","5.700101","10.169.156.72","162.125.19.9","TCP","","66","","49356  >  443 [ACK] Seq=11050 Ack=759 Win=2036 Len=0 TSval=495589014 TSecr=2768713114"
"28","5.865376","10.169.156.72","224.0.0.251","MDNS","","82","_googlecast._tcp.local","Standard query 0x0000 PTR _googlecast._tcp.local, ""QU"" question"
"29","5.865437","fe80::1077:59f9:f102:22da","ff02::fb","MDNS","","102","_googlecast._tcp.local","Standard query 0x0000 PTR _googlecast._tcp.local, ""QU"" question"
"30","6.633114","10.169.156.72","172.25.1.1","DNS","","80","wpad.dot1x.polimi.it","Standard query 0xd0eb A wpad.dot1x.polimi.it"
"31","6.640793","172.25.1.1","10.169.156.72","DNS","","80","wpad.dot1x.polimi.it","Standard query response 0xd0eb No such name A wpad.dot1x.polimi.it"
"32","6.644160","10.169.156.72","172.25.1.1","DNS","","89","clientservices.googleapis.com","Standard query 0x3e4b A clientservices.googleapis.com"
"33","6.645475","172.25.1.1","10.169.156.72","DNS","142.250.184.35","105","clientservices.googleapis.com","Standard query response 0x3e4b A clientservices.googleapis.com A 142.250.184.35"
"34","6.645733","10.169.156.72","142.250.184.35","TCP","","78","","49512  >  443 [SYN] Seq=0 Win=65535 Len=0 MSS=1460 WS=64 TSval=495589956 TSecr=0 SACK_PERM=1"
"35","6.646792","10.169.156.72","239.255.255.250","SSDP","","216","","M-SEARCH * HTTP/1.1 "
"36","6.648331","142.250.184.35","10.169.156.72","TCP","","74","","443  >  49512 [SYN, ACK] Seq=0 Ack=1 Win=65535 Len=0 MSS=1430 SACK_PERM=1 TSval=538383626 TSecr=495589956 WS=256"
"37","6.648403","10.169.156.72","142.250.184.35","TCP","","66","","49512  >  443 [ACK] Seq=1 Ack=1 Win=131840 Len=0 TSval=495589958 TSecr=538383626"
"38","6.648981","10.169.156.72","142.250.184.35","TLSv1.3","","583","","Client Hello"
"39","6.652346","142.250.184.35","10.169.156.72","TCP","","66","","443  >  49512 [ACK] Seq=1 Ack=518 Win=66816 Len=0 TSval=538383630 TSecr=495589958"
"40","6.671638","142.250.184.35","10.169.156.72","TLSv1.3","","1484","","Server Hello, Change Cipher Spec"
"41","6.671686","10.169.156.72","142.250.184.35","TCP","","66","","49512  >  443 [ACK] Seq=518 Ack=1419 Win=130432 Len=0 TSval=495589981 TSecr=538383648"
"42","6.672165","142.250.184.35","10.169.156.72","TCP","","1484","","443  >  49512 [ACK] Seq=1419 Ack=518 Win=66816 Len=1418 TSval=538383648 TSecr=495589958 [TCP segment of a reassembled PDU]"
"43","6.672168","142.250.184.35","10.169.156.72","TCP","","1484","","443  >  49512 [ACK] Seq=2837 Ack=518 Win=66816 Len=1418 TSval=538383648 TSecr=495589958 [TCP segment of a reassembled PDU]"
"44","6.672169","142.250.184.35","10.169.156.72","TLSv1.3","","493","","Application Data"
"45","6.672200","10.169.156.72","142.250.184.35","TCP","","66","","49512  >  443 [ACK] Seq=518 Ack=4682 Win=127808 Len=0 TSval=495589981 TSecr=538383648"
"46","6.672250","10.169.156.72","142.250.184.35","TCP","","66","","[TCP Window Update] 49512  >  443 [ACK] Seq=518 Ack=4682 Win=131072 Len=0 TSval=495589981 TSecr=538383648"
"47","6.680534","10.169.156.72","142.250.184.35","TLSv1.3","","130","","Change Cipher Spec, Application Data"
"48","6.680707","10.169.156.72","142.250.184.35","TLSv1.3","","158","","Application Data"
"49","6.680825","10.169.156.72","142.250.184.35","TLSv1.3","","390","","Application Data"
"50","6.683901","142.250.184.35","10.169.156.72","TLSv1.3","","674","","Application Data, Application Data"
"51","6.683937","10.169.156.72","142.250.184.35","TCP","","66","","49512  >  443 [ACK] Seq=998 Ack=5290 Win=130432 Len=0 TSval=495589992 TSecr=538383661"
"52","6.684015","10.169.156.72","142.250.184.35","TLSv1.3","","97","","Application Data"
"53","6.684489","142.250.184.35","10.169.156.72","TLSv1.3","","97","","Application Data"
"54","6.684516","10.169.156.72","142.250.184.35","TCP","","66","","49512  >  443 [ACK] Seq=1029 Ack=5321 Win=131008 Len=0 TSval=495589992 TSecr=538383662"
"55","6.684954","10.169.156.72","172.25.1.1","DNS","","80","wpad.dot1x.polimi.it","Standard query 0xf15a A wpad.dot1x.polimi.it"
"56","6.686106","172.25.1.1","10.169.156.72","DNS","","80","wpad.dot1x.polimi.it","Standard query response 0xf15a No such name A wpad.dot1x.polimi.it"
"57","6.688132","10.169.156.72","172.25.1.1","DNS","","79","accounts.google.com","Standard query 0x3422 A accounts.google.com"
"58","6.688230","10.169.156.72","172.25.1.1","DNS","","75","www.youtube.com","Standard query 0x2905 A www.youtube.com"
"59","6.689458","172.25.1.1","10.169.156.72","DNS","142.250.180.141","95","accounts.google.com","Standard query response 0x3422 A accounts.google.com A 142.250.180.141"
"60","6.689558","10.169.156.72","142.250.180.141","TCP","","78","","49513  >  443 [SYN] Seq=0 Win=65535 Len=0 MSS=1460 WS=64 TSval=495589997 TSecr=0 SACK_PERM=1"
"61","6.690009","172.25.1.1","10.169.156.72","DNS","142.250.184.110,142.250.180.142,142.250.180.174,216.58.208.142,216.58.208.174,216.58.209.46,142.250.184.46,142.250.184.78","237","www.youtube.com","Standard query response 0x2905 A www.youtube.com CNAME youtube-ui.l.google.com A 142.250.184.110 A 142.250.180.142 A 142.250.180.174 A 216.58.208.142 A 216.58.208.174 A 216.58.209.46 A 142.250.184.46 A 142.250.184.78"
"62","6.690102","10.169.156.72","142.250.184.110","TCP","","78","","49514  >  443 [SYN] Seq=0 Win=65535 Len=0 MSS=1460 WS=64 TSval=495589997 TSecr=0 SACK_PERM=1"
"63","6.690935","142.250.184.35","10.169.156.72","TCP","","66","","443  >  49512 [ACK] Seq=5321 Ack=1029 Win=67840 Len=0 TSval=538383669 TSecr=495589992"
"64","6.692198","142.250.180.141","10.169.156.72","TCP","","74","","443  >  49513 [SYN, ACK] Seq=0 Ack=1 Win=65535 Len=0 MSS=1430 SACK_PERM=1 TSval=476471039 TSecr=495589997 WS=256"
"65","6.692229","10.169.156.72","142.250.180.141","TCP","","66","","49513  >  443 [ACK] Seq=1 Ack=1 Win=131840 Len=0 TSval=495589999 TSecr=476471039"
"66","6.692364","10.169.156.72","142.250.180.141","TLSv1.3","","583","","Client Hello"
"67","6.692797","142.250.184.110","10.169.156.72","TCP","","74","","443  >  49514 [SYN, ACK] Seq=0 Ack=1 Win=65535 Len=0 MSS=1430 SACK_PERM=1 TSval=2034985522 TSecr=495589997 WS=256"
"68","6.692822","10.169.156.72","142.250.184.110","TCP","","66","","49514  >  443 [ACK] Seq=1 Ack=1 Win=131840 Len=0 TSval=495589999 TSecr=2034985522"
"69","6.692919","10.169.156.72","142.250.184.110","TLSv1.3","","583","","Client Hello"
"70","6.695736","142.250.180.141","10.169.156.72","TCP","","66","","443  >  49513 [ACK] Seq=1 Ack=518 Win=66816 Len=0 TSval=476471042 TSecr=495589999"
"71","6.697136","142.250.184.110","10.169.156.72","TCP","","66","","443  >  49514 [ACK] Seq=1 Ack=518 Win=66816 Len=0 TSval=2034985526 TSecr=495589999"
"72","6.700990","142.250.184.35","10.169.156.72","TLSv1.3","","326","","Application Data"
"73","6.701028","10.169.156.72","142.250.184.35","TCP","","66","","49512  >  443 [ACK] Seq=1029 Ack=5581 Win=130752 Len=0 TSval=495590006 TSecr=538383679"
"74","6.701151","142.250.184.35","10.169.156.72","TLSv1.3","","97","","Application Data"
"75","6.701169","10.169.156.72","142.250.184.35","TCP","","66","","49512  >  443 [ACK] Seq=1029 Ack=5612 Win=131008 Len=0 TSval=495590006 TSecr=538383679"
"76","6.701399","142.250.184.35","10.169.156.72","TLSv1.3","","105","","Application Data"
"77","6.701418","10.169.156.72","142.250.184.35","TCP","","66","","49512  >  443 [ACK] Seq=1029 Ack=5651 Win=131008 Len=0 TSval=495590006 TSecr=538383679"
"78","6.701673","10.169.156.72","142.250.184.35","TLSv1.3","","105","","Application Data"
"79","6.708330","142.250.184.35","10.169.156.72","TCP","","66","","443  >  49512 [ACK] Seq=5651 Ack=1068 Win=67840 Len=0 TSval=538383686 TSecr=495590006"
"80","6.712783","142.250.180.141","10.169.156.72","TLSv1.3","","1484","","Server Hello, Change Cipher Spec"
"81","6.712824","10.169.156.72","142.250.180.141","TCP","","66","","49513  >  443 [ACK] Seq=518 Ack=1419 Win=130432 Len=0 TSval=495590017 TSecr=476471058"
"82","6.713530","142.250.180.141","10.169.156.72","TCP","","1484","","443  >  49513 [ACK] Seq=1419 Ack=518 Win=66816 Len=1418 TSval=476471058 TSecr=495589999 [TCP segment of a reassembled PDU]"
"83","6.713532","142.250.180.141","10.169.156.72","TCP","","1484","","443  >  49513 [ACK] Seq=2837 Ack=518 Win=66816 Len=1418 TSval=476471058 TSecr=495589999 [TCP segment of a reassembled PDU]"
"84","6.713534","142.250.180.141","10.169.156.72","TLSv1.3","","279","","Application Data"
"85","6.713563","10.169.156.72","142.250.180.141","TCP","","66","","49513  >  443 [ACK] Seq=518 Ack=4468 Win=128000 Len=0 TSval=495590017 TSecr=476471058"
"86","6.713588","10.169.156.72","142.250.180.141","TCP","","66","","[TCP Window Update] 49513  >  443 [ACK] Seq=518 Ack=4468 Win=131072 Len=0 TSval=495590017 TSecr=476471058"
"87","6.714263","142.250.184.110","10.169.156.72","TLSv1.3","","1484","","Server Hello, Change Cipher Spec"
"88","6.714297","10.169.156.72","142.250.184.110","TCP","","66","","49514  >  443 [ACK] Seq=518 Ack=1419 Win=130432 Len=0 TSval=495590018 TSecr=2034985542"
"89","6.714680","142.250.184.110","10.169.156.72","TCP","","1484","","443  >  49514 [ACK] Seq=1419 Ack=518 Win=66816 Len=1418 TSval=2034985542 TSecr=495589999 [TCP segment of a reassembled PDU]"
"90","6.714682","142.250.184.110","10.169.156.72","TCP","","1484","","443  >  49514 [ACK] Seq=2837 Ack=518 Win=66816 Len=1418 TSval=2034985542 TSecr=495589999 [TCP segment of a reassembled PDU]"
"91","6.714699","10.169.156.72","142.250.184.110","TCP","","66","","49514  >  443 [ACK] Seq=518 Ack=4255 Win=128192 Len=0 TSval=495590018 TSecr=2034985542"
"92","6.714715","10.169.156.72","142.250.184.110","TCP","","66","","[TCP Window Update] 49514  >  443 [ACK] Seq=518 Ack=4255 Win=131072 Len=0 TSval=495590018 TSecr=2034985542"
"93","6.714870","142.250.184.110","10.169.156.72","TCP","","1484","","443  >  49514 [ACK] Seq=4255 Ack=518 Win=66816 Len=1418 TSval=2034985542 TSecr=495589999 [TCP segment of a reassembled PDU]"
"94","6.714872","142.250.184.110","10.169.156.72","TLSv1.3","","1206","","Application Data"
"95","6.714884","10.169.156.72","142.250.184.110","TCP","","66","","49514  >  443 [ACK] Seq=518 Ack=6813 Win=128512 Len=0 TSval=495590018 TSecr=2034985542"
"96","6.717565","10.169.156.72","142.250.180.141","TLSv1.3","","140","","Change Cipher Spec, Application Data"
"97","6.717716","10.169.156.72","142.250.180.141","TLSv1.3","","158","","Application Data"
"98","6.717791","10.169.156.72","142.250.180.141","TCP","","1484","","49513  >  443 [ACK] Seq=684 Ack=4468 Win=131072 Len=1418 TSval=495590021 TSecr=476471058 [TCP segment of a reassembled PDU]"
"99","6.717791","10.169.156.72","142.250.180.141","TLSv1.3","","425","","Application Data"
"100","6.717802","10.169.156.72","142.250.180.141","TLSv1.3","","98","","Application Data"
"101","6.720546","10.169.156.72","142.250.184.110","TLSv1.3","","140","","Change Cipher Spec, Application Data"
"102","6.720617","10.169.156.72","142.250.184.110","TLSv1.3","","158","","Application Data"
"103","6.720759","142.250.180.141","10.169.156.72","TCP","","66","","443  >  49513 [ACK] Seq=4468 Ack=2102 Win=69632 Len=0 TSval=476471067 TSecr=495590021"
"104","6.721554","142.250.180.141","10.169.156.72","TLSv1.3","","984","","Application Data, Application Data"
"105","6.721586","10.169.156.72","142.250.180.141","TCP","","66","","49513  >  443 [ACK] Seq=2493 Ack=5386 Win=130112 Len=0 TSval=495590024 TSecr=476471068"
"106","6.721902","10.169.156.72","142.250.180.141","TLSv1.3","","97","","Application Data"
"107","6.722663","10.169.156.72","142.250.184.110","TCP","","1484","","49514  >  443 [ACK] Seq=684 Ack=6813 Win=131072 Len=1418 TSval=495590025 TSecr=2034985542 [TCP segment of a reassembled PDU]"
"108","6.722664","10.169.156.72","142.250.184.110","TLSv1.3","","257","","Application Data"
"109","6.723277","142.250.180.141","10.169.156.72","TLSv1.3","","97","","Application Data"
"110","6.723280","142.250.184.110","10.169.156.72","TLSv1.3","","976","","Application Data, Application Data"
"111","6.723311","10.169.156.72","142.250.180.141","TCP","","66","","49513  >  443 [ACK] Seq=2524 Ack=5417 Win=131008 Len=0 TSval=495590025 TSecr=476471070"
"112","6.723321","10.169.156.72","142.250.184.110","TCP","","66","","49514  >  443 [ACK] Seq=2293 Ack=7723 Win=130112 Len=0 TSval=495590025 TSecr=2034985552"
"113","6.723410","10.169.156.72","142.250.184.110","TLSv1.3","","97","","Application Data"
"114","6.724324","142.250.184.110","10.169.156.72","TLSv1.3","","97","","Application Data"
"115","6.724364","10.169.156.72","142.250.184.110","TCP","","66","","49514  >  443 [ACK] Seq=2324 Ack=7754 Win=131008 Len=0 TSval=495590026 TSecr=2034985553"
"116","6.726765","142.250.184.110","10.169.156.72","TCP","","66","","443  >  49514 [ACK] Seq=7754 Ack=2293 Win=72448 Len=0 TSval=2034985556 TSecr=495590025"
"117","6.726936","142.250.180.141","10.169.156.72","TCP","","66","","443  >  49513 [ACK] Seq=5417 Ack=2524 Win=72448 Len=0 TSval=476471074 TSecr=495590024"
"118","6.730331","10.169.156.72","142.250.184.110","TCP","","97","","[TCP Retransmission] 49514  >  443 [PSH, ACK] Seq=2293 Ack=7754 Win=131072 Len=31 TSval=495590031 TSecr=2034985556"
"119","6.731885","142.250.184.110","10.169.156.72","TCP","","66","","443  >  49514 [ACK] Seq=7754 Ack=2324 Win=72448 Len=0 TSval=2034985561 TSecr=495590025"
"120","6.732489","142.250.184.110","10.169.156.72","TCP","","78","","[TCP Dup ACK 119#1] 443  >  49514 [ACK] Seq=7754 Ack=2324 Win=72448 Len=0 TSval=2034985562 TSecr=495590031 SLE=2293 SRE=2324"
"121","6.753596","142.250.180.141","10.169.156.72","TLSv1.3","","1166","","Application Data"
"122","6.753675","10.169.156.72","142.250.180.141","TCP","","66","","49513  >  443 [ACK] Seq=2524 Ack=6517 Win=129920 Len=0 TSval=495590053 TSecr=476471100"
"123","6.753842","142.250.180.141","10.169.156.72","TLSv1.3","","801","","Application Data, Application Data, Application Data"
"124","6.753844","142.250.180.141","10.169.156.72","TLSv1.3","","105","","Application Data"
"125","6.753876","10.169.156.72","142.250.180.141","TCP","","66","","49513  >  443 [ACK] Seq=2524 Ack=7291 Win=130240 Len=0 TSval=495590053 TSecr=476471100"
"126","6.754845","10.169.156.72","142.250.180.141","TLSv1.3","","105","","Application Data"
"127","6.762084","142.250.180.141","10.169.156.72","TCP","","66","","443  >  49513 [ACK] Seq=7291 Ack=2563 Win=72448 Len=0 TSval=476471109 TSecr=495590054"
"128","6.786113","142.250.184.110","10.169.156.72","TLSv1.3","","1371","","Application Data"
"129","6.786191","10.169.156.72","142.250.184.110","TCP","","66","","49514  >  443 [ACK] Seq=2324 Ack=9059 Win=129728 Len=0 TSval=495590084 TSecr=2034985615"
"130","6.786347","142.250.184.110","10.169.156.72","TLSv1.3","","1484","","Application Data"
"131","6.786352","142.250.184.110","10.169.156.72","TLSv1.3","","1312","","Application Data"
"132","6.786406","10.169.156.72","142.250.184.110","TCP","","66","","49514  >  443 [ACK] Seq=2324 Ack=11723 Win=128384 Len=0 TSval=495590084 TSecr=2034985615"
"133","6.788404","142.250.184.110","10.169.156.72","TLSv1.3","","1484","","Application Data"
"134","6.788458","10.169.156.72","142.250.184.110","TCP","","66","","49514  >  443 [ACK] Seq=2324 Ack=13141 Win=129600 Len=0 TSval=495590086 TSecr=2034985617"
"135","6.788770","142.250.184.110","10.169.156.72","TLSv1.3","","1484","","Application Data"
"136","6.788775","142.250.184.110","10.169.156.72","TLSv1.3","","1484","","Application Data"
"137","6.788828","10.169.156.72","142.250.184.110","TCP","","66","","49514  >  443 [ACK] Seq=2324 Ack=15977 Win=128192 Len=0 TSval=495590086 TSecr=2034985617"
"138","6.788862","10.169.156.72","142.250.184.110","TCP","","66","","[TCP Window Update] 49514  >  443 [ACK] Seq=2324 Ack=15977 Win=131072 Len=0 TSval=495590086 TSecr=2034985617"
"139","6.789027","142.250.184.110","10.169.156.72","TLSv1.3","","1484","","Application Data"
"140","6.789033","142.250.184.110","10.169.156.72","TLSv1.3","","1484","","Application Data"
"141","6.789072","10.169.156.72","142.250.184.110","TCP","","66","","49514  >  443 [ACK] Seq=2324 Ack=18813 Win=128192 Len=0 TSval=495590086 TSecr=2034985617"
"142","6.789179","10.169.156.72","142.250.184.110","TCP","","66","","[TCP Window Update] 49514  >  443 [ACK] Seq=2324 Ack=18813 Win=131072 Len=0 TSval=495590086 TSecr=2034985617"
"143","6.789813","142.250.184.110","10.169.156.72","TLSv1.3","","1484","","Application Data"
"144","6.789817","142.250.184.110","10.169.156.72","TLSv1.3","","1463","","Application Data"
"145","6.789858","10.169.156.72","142.250.184.110","TCP","","66","","49514  >  443 [ACK] Seq=2324 Ack=21628 Win=128256 Len=0 TSval=495590087 TSecr=2034985617"
"146","6.790135","142.250.184.110","10.169.156.72","TLSv1.3","","1484","","Application Data"
"147","6.790139","142.250.184.110","10.169.156.72","TLSv1.3","","1484","","Application Data"
"148","6.790141","142.250.184.110","10.169.156.72","TLSv1.3","","204","","Application Data"
"149","6.790195","10.169.156.72","142.250.184.110","TCP","","66","","49514  >  443 [ACK] Seq=2324 Ack=24602 Win=128064 Len=0 TSval=495590087 TSecr=2034985618"
"150","6.790281","10.169.156.72","142.250.184.110","TCP","","66","","[TCP Window Update] 49514  >  443 [ACK] Seq=2324 Ack=24602 Win=131072 Len=0 TSval=495590087 TSecr=2034985618"
"151","6.790456","142.250.184.110","10.169.156.72","TLSv1.3","","166","","Application Data"
"152","6.790459","142.250.184.110","10.169.156.72","TLSv1.3","","359","","Application Data"
"153","6.790499","10.169.156.72","142.250.184.110","TCP","","66","","49514  >  443 [ACK] Seq=2324 Ack=24995 Win=130624 Len=0 TSval=495590087 TSecr=2034985619"
"154","6.790814","142.250.184.110","10.169.156.72","TLSv1.3","","239","","Application Data"
"155","6.790859","10.169.156.72","142.250.184.110","TCP","","66","","49514  >  443 [ACK] Seq=2324 Ack=25168 Win=130880 Len=0 TSval=495590088 TSecr=2034985620"
"156","6.791129","142.250.184.110","10.169.156.72","TLSv1.3","","1484","","Application Data"
"157","6.791132","142.250.184.110","10.169.156.72","TLSv1.3","","1070","","Application Data"
"158","6.791167","10.169.156.72","142.250.184.110","TCP","","66","","49514  >  443 [ACK] Seq=2324 Ack=27590 Win=128640 Len=0 TSval=495590088 TSecr=2034985620"
"159","6.791755","142.250.184.110","10.169.156.72","TLSv1.3","","1484","","Application Data"
"160","6.791793","10.169.156.72","142.250.184.110","TCP","","66","","49514  >  443 [ACK] Seq=2324 Ack=29008 Win=129600 Len=0 TSval=495590088 TSecr=2034985621"
"161","6.792708","142.250.184.110","10.169.156.72","TLSv1.3","","1484","","Application Data"
"162","6.792711","142.250.184.110","10.169.156.72","TLSv1.3","","580","","Application Data"
"163","6.792712","142.250.184.110","10.169.156.72","TLSv1.3","","458","","Application Data"
"164","6.792745","10.169.156.72","142.250.184.110","TCP","","66","","49514  >  443 [ACK] Seq=2324 Ack=31332 Win=128704 Len=0 TSval=495590089 TSecr=2034985621"
"165","6.797186","10.169.156.72","172.25.1.1","DNS","","78","www.googleapis.com","Standard query 0x43f6 A www.googleapis.com"
"166","6.798512","172.25.1.1","10.169.156.72","DNS","216.58.208.170,216.58.209.42,142.250.184.42,142.250.184.74,142.250.184.106,142.250.180.138,142.250.180.170,216.58.208.138","206","www.googleapis.com","Standard query response 0x43f6 A www.googleapis.com A 216.58.208.170 A 216.58.209.42 A 142.250.184.42 A 142.250.184.74 A 142.250.184.106 A 142.250.180.138 A 142.250.180.170 A 216.58.208.138"
"167","6.798668","10.169.156.72","216.58.208.170","TCP","","78","","49515  >  443 [SYN] Seq=0 Win=65535 Len=0 MSS=1460 WS=64 TSval=495590094 TSecr=0 SACK_PERM=1"
"168","6.801102","216.58.208.170","10.169.156.72","TCP","","74","","443  >  49515 [SYN, ACK] Seq=0 Ack=1 Win=65535 Len=0 MSS=1430 SACK_PERM=1 TSval=558398508 TSecr=495590094 WS=256"
"169","6.801144","10.169.156.72","216.58.208.170","TCP","","66","","49515  >  443 [ACK] Seq=1 Ack=1 Win=131840 Len=0 TSval=495590096 TSecr=558398508"
"170","6.801278","10.169.156.72","216.58.208.170","TLSv1.3","","583","","Client Hello"
"171","6.805255","216.58.208.170","10.169.156.72","TCP","","66","","443  >  49515 [ACK] Seq=1 Ack=518 Win=66816 Len=0 TSval=558398512 TSecr=495590096"
"172","6.813751","10.169.156.72","172.25.1.1","DNS","","71","i.ytimg.com","Standard query 0xa46e A i.ytimg.com"
"173","6.815046","172.25.1.1","10.169.156.72","DNS","142.250.184.118,142.250.180.150,142.250.180.182,216.58.208.150,216.58.208.182,216.58.209.54,142.250.184.54,142.250.184.86","199","i.ytimg.com","Standard query response 0xa46e A i.ytimg.com A 142.250.184.118 A 142.250.180.150 A 142.250.180.182 A 216.58.208.150 A 216.58.208.182 A 216.58.209.54 A 142.250.184.54 A 142.250.184.86"
"174","6.815270","10.169.156.72","142.250.184.118","TCP","","78","","49516  >  443 [SYN] Seq=0 Win=65535 Len=0 MSS=1460 WS=64 TSval=495590109 TSecr=0 SACK_PERM=1"
"175","6.817886","142.250.184.118","10.169.156.72","TCP","","74","","443  >  49516 [SYN, ACK] Seq=0 Ack=1 Win=65535 Len=0 MSS=1430 SACK_PERM=1 TSval=3723984358 TSecr=495590109 WS=256"
"176","6.817947","10.169.156.72","142.250.184.118","TCP","","66","","49516  >  443 [ACK] Seq=1 Ack=1 Win=131840 Len=0 TSval=495590111 TSecr=3723984358"
"177","6.818121","10.169.156.72","142.250.184.118","TLSv1.3","","583","","Client Hello"
"178","6.819285","10.169.156.72","172.25.1.1","DNS","","93","r2---sn-b5gg-ca9l.googlevideo.com","Standard query 0x7964 A r2---sn-b5gg-ca9l.googlevideo.com"
"179","6.821438","172.25.1.1","10.169.156.72","DNS","193.206.135.77","139","r2---sn-b5gg-ca9l.googlevideo.com","Standard query response 0x7964 A r2---sn-b5gg-ca9l.googlevideo.com CNAME r2.sn-b5gg-ca9l.googlevideo.com A 193.206.135.77"
"180","6.821862","10.169.156.72","193.206.135.77","TCP","","78","","49517  >  443 [SYN] Seq=0 Win=65535 Len=0 MSS=1460 WS=64 TSval=495590114 TSecr=0 SACK_PERM=1"
"181","6.821949","142.250.184.118","10.169.156.72","TCP","","66","","443  >  49516 [ACK] Seq=1 Ack=518 Win=66816 Len=0 TSval=3723984363 TSecr=495590111"
"182","6.821955","10.169.156.72","193.206.135.77","TCP","","78","","49518  >  443 [SYN] Seq=0 Win=65535 Len=0 MSS=1460 WS=64 TSval=495590114 TSecr=0 SACK_PERM=1"
"183","6.822700","10.169.156.72","172.25.1.1","DNS","","77","fonts.gstatic.com","Standard query 0xfe24 A fonts.gstatic.com"
"184","6.822732","216.58.208.170","10.169.156.72","TLSv1.3","","1484","","Server Hello, Change Cipher Spec"
"185","6.822770","10.169.156.72","216.58.208.170","TCP","","66","","49515  >  443 [ACK] Seq=518 Ack=1419 Win=130432 Len=0 TSval=495590114 TSecr=558398528"
"186","6.823059","216.58.208.170","10.169.156.72","TCP","","1484","","443  >  49515 [ACK] Seq=1419 Ack=518 Win=66816 Len=1418 TSval=558398528 TSecr=495590096 [TCP segment of a reassembled PDU]"
"187","6.823061","216.58.208.170","10.169.156.72","TCP","","1484","","443  >  49515 [ACK] Seq=2837 Ack=518 Win=66816 Len=1418 TSval=558398528 TSecr=495590096 [TCP segment of a reassembled PDU]"
"188","6.823089","10.169.156.72","216.58.208.170","TCP","","66","","49515  >  443 [ACK] Seq=518 Ack=4255 Win=128192 Len=0 TSval=495590115 TSecr=558398528"
"189","6.823221","10.169.156.72","216.58.208.170","TCP","","66","","[TCP Window Update] 49515  >  443 [ACK] Seq=518 Ack=4255 Win=131072 Len=0 TSval=495590115 TSecr=558398528"
"190","6.823458","216.58.208.170","10.169.156.72","TLSv1.3","","492","","Application Data"
"191","6.823486","10.169.156.72","216.58.208.170","TCP","","66","","49515  >  443 [ACK] Seq=518 Ack=4681 Win=130624 Len=0 TSval=495590115 TSecr=558398528"
"192","6.824445","172.25.1.1","10.169.156.72","DNS","216.58.209.35","129","fonts.gstatic.com","Standard query response 0xfe24 A fonts.gstatic.com CNAME gstaticadssl.l.google.com A 216.58.209.35"
"193","6.825478","10.169.156.72","216.58.209.35","QUIC","","1292","","Initial, DCID=eea4c7a090f6d9a9, PKN: 1, CRYPTO, CRYPTO, PADDING, CRYPTO, PADDING, CRYPTO, CRYPTO, CRYPTO, PADDING, PING, PADDING, PING, PADDING, PING"
"194","6.826889","193.206.135.77","10.169.156.72","TCP","","74","","443  >  49517 [SYN, ACK] Seq=0 Ack=1 Win=65535 Len=0 MSS=1460 SACK_PERM=1 TSval=677026810 TSecr=495590114 WS=256"
"195","6.826941","10.169.156.72","193.206.135.77","TCP","","66","","49517  >  443 [ACK] Seq=1 Ack=1 Win=131712 Len=0 TSval=495590119 TSecr=677026810"
"196","6.827173","10.169.156.72","193.206.135.77","TLSv1.3","","583","","Client Hello"
"197","6.827932","193.206.135.77","10.169.156.72","TCP","","74","","443  >  49518 [SYN, ACK] Seq=0 Ack=1 Win=65535 Len=0 MSS=1460 SACK_PERM=1 TSval=677026811 TSecr=495590114 WS=256"
"198","6.827987","10.169.156.72","193.206.135.77","TCP","","66","","49518  >  443 [ACK] Seq=1 Ack=1 Win=131712 Len=0 TSval=495590120 TSecr=677026811"
"199","6.828164","10.169.156.72","193.206.135.77","TLSv1.3","","583","","Client Hello"
"200","6.829144","10.169.156.72","216.58.208.170","TLSv1.3","","130","","Change Cipher Spec, Application Data"
"201","6.829272","10.169.156.72","216.58.208.170","TLSv1.3","","158","","Application Data"
"202","6.829388","10.169.156.72","216.58.208.170","TLSv1.3","","354","","Application Data"
"203","6.829407","10.169.156.72","216.58.208.170","TLSv1.3","","386","","Application Data"
"204","6.831788","216.58.208.170","10.169.156.72","TLSv1.3","","674","","Application Data, Application Data"
"205","6.831791","216.58.208.170","10.169.156.72","TCP","","66","","443  >  49515 [ACK] Seq=5289 Ack=1282 Win=68864 Len=0 TSval=558398538 TSecr=495590121"
"206","6.831841","10.169.156.72","216.58.208.170","TCP","","66","","49515  >  443 [ACK] Seq=1282 Ack=5289 Win=130432 Len=0 TSval=495590123 TSecr=558398538"
"207","6.831973","10.169.156.72","216.58.208.170","TLSv1.3","","97","","Application Data"
"208","6.832350","216.58.208.170","10.169.156.72","TLSv1.3","","97","","Application Data"
"209","6.832383","10.169.156.72","216.58.208.170","TCP","","66","","49515  >  443 [ACK] Seq=1313 Ack=5320 Win=131008 Len=0 TSval=495590123 TSecr=558398539"
"210","6.832928","193.206.135.77","10.169.156.72","TCP","","66","","443  >  49517 [ACK] Seq=1 Ack=518 Win=66816 Len=0 TSval=677026816 TSecr=495590119"
"211","6.834106","193.206.135.77","10.169.156.72","TCP","","66","","443  >  49518 [ACK] Seq=1 Ack=518 Win=66816 Len=0 TSval=677026818 TSecr=495590120"
"212","6.835026","193.206.135.77","10.169.156.72","TLSv1.3","","1514","","Server Hello, Change Cipher Spec"
"213","6.835062","10.169.156.72","193.206.135.77","TCP","","66","","49517  >  443 [ACK] Seq=518 Ack=1449 Win=130304 Len=0 TSval=495590125 TSecr=677026817"
"214","6.835402","193.206.135.77","10.169.156.72","TCP","","1514","","443  >  49517 [ACK] Seq=1449 Ack=518 Win=66816 Len=1448 TSval=677026817 TSecr=495590119 [TCP segment of a reassembled PDU]"
"215","6.835405","193.206.135.77","10.169.156.72","TCP","","1514","","443  >  49517 [ACK] Seq=2897 Ack=518 Win=66816 Len=1448 TSval=677026817 TSecr=495590119 [TCP segment of a reassembled PDU]"
"216","6.835427","10.169.156.72","193.206.135.77","TCP","","66","","49517  >  443 [ACK] Seq=518 Ack=4345 Win=128128 Len=0 TSval=495590126 TSecr=677026817"
"217","6.835446","10.169.156.72","193.206.135.77","TCP","","66","","[TCP Window Update] 49517  >  443 [ACK] Seq=518 Ack=4345 Win=131072 Len=0 TSval=495590126 TSecr=677026817"
"218","6.835571","193.206.135.77","10.169.156.72","TLSv1.3","","691","","Application Data"
"219","6.835600","10.169.156.72","193.206.135.77","TCP","","66","","49517  >  443 [ACK] Seq=518 Ack=4970 Win=130432 Len=0 TSval=495590126 TSecr=677026817"
"220","6.836692","193.206.135.77","10.169.156.72","TLSv1.3","","1514","","Server Hello, Change Cipher Spec"
"221","6.836722","10.169.156.72","193.206.135.77","TCP","","66","","49518  >  443 [ACK] Seq=518 Ack=1449 Win=130304 Len=0 TSval=495590127 TSecr=677026819"
"222","6.837101","193.206.135.77","10.169.156.72","TCP","","1514","","443  >  49518 [ACK] Seq=1449 Ack=518 Win=66816 Len=1448 TSval=677026819 TSecr=495590120 [TCP segment of a reassembled PDU]"
"223","6.837104","193.206.135.77","10.169.156.72","TCP","","1514","","443  >  49518 [ACK] Seq=2897 Ack=518 Win=66816 Len=1448 TSval=677026819 TSecr=495590120 [TCP segment of a reassembled PDU]"
"224","6.837151","10.169.156.72","193.206.135.77","TCP","","66","","49518  >  443 [ACK] Seq=518 Ack=4345 Win=128128 Len=0 TSval=495590127 TSecr=677026819"
"225","6.837670","193.206.135.77","10.169.156.72","TLSv1.3","","691","","Application Data"
"226","6.837692","10.169.156.72","193.206.135.77","TCP","","66","","49518  >  443 [ACK] Seq=518 Ack=4970 Win=127488 Len=0 TSval=495590127 TSecr=677026819"
"227","6.837928","10.169.156.72","193.206.135.77","TCP","","66","","[TCP Window Update] 49518  >  443 [ACK] Seq=518 Ack=4970 Win=131072 Len=0 TSval=495590128 TSecr=677026819"
"228","6.838775","216.58.208.170","10.169.156.72","TCP","","66","","443  >  49515 [ACK] Seq=5320 Ack=1313 Win=68864 Len=0 TSval=558398546 TSecr=495590123"
"229","6.840022","142.250.184.118","10.169.156.72","TLSv1.3","","1484","","Server Hello, Change Cipher Spec"
"230","6.840060","10.169.156.72","142.250.184.118","TCP","","66","","49516  >  443 [ACK] Seq=518 Ack=1419 Win=130432 Len=0 TSval=495590130 TSecr=3723984380"
"231","6.840515","142.250.184.118","10.169.156.72","TCP","","1484","","443  >  49516 [ACK] Seq=1419 Ack=518 Win=66816 Len=1418 TSval=3723984380 TSecr=495590111 [TCP segment of a reassembled PDU]"
"232","6.840518","142.250.184.118","10.169.156.72","TCP","","1484","","443  >  49516 [ACK] Seq=2837 Ack=518 Win=66816 Len=1418 TSval=3723984380 TSecr=495590111 [TCP segment of a reassembled PDU]"
"233","6.840519","142.250.184.118","10.169.156.72","TLSv1.3","","559","","Application Data"
"234","6.840548","10.169.156.72","142.250.184.118","TCP","","66","","49516  >  443 [ACK] Seq=518 Ack=4748 Win=127104 Len=0 TSval=495590130 TSecr=3723984380"
"235","6.841209","10.169.156.72","142.250.184.118","TCP","","66","","[TCP Window Update] 49516  >  443 [ACK] Seq=518 Ack=4748 Win=131072 Len=0 TSval=495590131 TSecr=3723984380"
"236","6.845973","10.169.156.72","193.206.135.77","TLSv1.3","","130","","Change Cipher Spec, Application Data"
"237","6.846192","10.169.156.72","193.206.135.77","TLSv1.3","","130","","Change Cipher Spec, Application Data"
"238","6.846353","10.169.156.72","193.206.135.77","TLSv1.3","","1038","","Application Data"
"239","6.846404","10.169.156.72","193.206.135.77","TLSv1.3","","1044","","Application Data"
"240","6.850558","10.169.156.72","142.250.184.118","TLSv1.3","","130","","Change Cipher Spec, Application Data"
"241","6.850730","10.169.156.72","142.250.184.118","TLSv1.3","","158","","Application Data"
"242","6.850836","10.169.156.72","142.250.184.118","TLSv1.3","","748","","Application Data"
"243","6.852859","193.206.135.77","10.169.156.72","TCP","","66","","443  >  49517 [ACK] Seq=4970 Ack=1554 Win=69632 Len=0 TSval=677026836 TSecr=495590135"
"244","6.853242","193.206.135.77","10.169.156.72","TCP","","66","","443  >  49518 [ACK] Seq=4970 Ack=1560 Win=69632 Len=0 TSval=677026836 TSecr=495590135"
"245","6.853245","193.206.135.77","10.169.156.72","TLSv1.3","","805","","Application Data, Application Data"
"246","6.853246","193.206.135.77","10.169.156.72","TLSv1.3","","805","","Application Data, Application Data"
"247","6.853282","10.169.156.72","193.206.135.77","TCP","","66","","49518  >  443 [ACK] Seq=1560 Ack=5709 Win=130304 Len=0 TSval=495590141 TSecr=677026836"
"248","6.853305","10.169.156.72","193.206.135.77","TCP","","66","","49517  >  443 [ACK] Seq=1554 Ack=5709 Win=130304 Len=0 TSval=495590141 TSecr=677026836"
"249","6.853449","142.250.184.118","10.169.156.72","TLSv1.3","","674","","Application Data, Application Data"
"250","6.853485","10.169.156.72","142.250.184.118","TCP","","66","","49516  >  443 [ACK] Seq=1356 Ack=5356 Win=130432 Len=0 TSval=495590141 TSecr=3723984394"
"251","6.854083","10.169.156.72","142.250.184.118","TLSv1.3","","97","","Application Data"
"252","6.854422","142.250.184.118","10.169.156.72","TLSv1.3","","97","","Application Data"
"253","6.854459","10.169.156.72","142.250.184.118","TCP","","66","","49516  >  443 [ACK] Seq=1387 Ack=5387 Win=131008 Len=0 TSval=495590142 TSecr=3723984395"
"254","6.854802","142.250.184.118","10.169.156.72","TLSv1.3","","283","","Application Data"
"255","6.854830","10.169.156.72","142.250.184.118","TCP","","66","","49516  >  443 [ACK] Seq=1387 Ack=5604 Win=130816 Len=0 TSval=495590142 TSecr=3723984395"
"256","6.855375","10.169.156.72","142.250.184.118","TLSv1.3","","105","","Application Data"
"257","6.857714","142.250.184.118","10.169.156.72","TCP","","66","","443  >  49516 [ACK] Seq=5604 Ack=1426 Win=68096 Len=0 TSval=3723984398 TSecr=495590142"
"258","6.868183","216.58.208.170","10.169.156.72","TLSv1.3","","478","","Application Data"
"259","6.868246","10.169.156.72","216.58.208.170","TCP","","66","","49515  >  443 [ACK] Seq=1313 Ack=5732 Win=130624 Len=0 TSval=495590155 TSecr=558398575"
"260","6.868380","216.58.208.170","10.169.156.72","TLSv1.3","","587","","Application Data"
"261","6.868383","216.58.208.170","10.169.156.72","TLSv1.3","","230","","Application Data"
"262","6.868385","216.58.208.170","10.169.156.72","TLSv1.3","","105","","Application Data"
"263","6.868418","10.169.156.72","216.58.208.170","TCP","","66","","49515  >  443 [ACK] Seq=1313 Ack=6456 Win=130304 Len=0 TSval=495590155 TSecr=558398575"
"264","6.869140","10.169.156.72","216.58.208.170","TLSv1.3","","105","","Application Data"
"265","6.870144","10.169.156.72","172.25.1.1","DNS","","78","history.google.com","Standard query 0x1473 A history.google.com"
